{
  "exam_code": "SY0-701",
  "version": "1.0.0",
  "source_pdf": "SY0-701-Exam-Objectives.pdf",
  "generated_at": "2026-02-14T00:00:00.000Z",
  "domains": [
    { "id": "1.0", "title": "General Security Concepts" },
    { "id": "2.0", "title": "Threats, Vulnerabilities, and Mitigations" },
    { "id": "3.0", "title": "Security Architecture" },
    { "id": "4.0", "title": "Security Operations" },
    { "id": "5.0", "title": "Security Program Management and Oversight" }
  ],
  "objectives": [
    { "id": "1.1", "title": "Compare and contrast various types of security controls.", "domain_id": "1.0" },
    { "id": "1.2", "title": "Summarize fundamental security concepts.", "domain_id": "1.0" },
    { "id": "1.3", "title": "Explain the importance of change management processes and controls.", "domain_id": "1.0" },
    { "id": "1.4", "title": "Explain the importance of using cryptographic solutions.", "domain_id": "1.0" },
    { "id": "1.5", "title": "Explain the importance of physical security.", "domain_id": "1.0" },
    { "id": "1.6", "title": "Explain the importance of resilience and recovery in security architecture.", "domain_id": "1.0" },
    { "id": "2.1", "title": "Compare and contrast common threat actors and motivations.", "domain_id": "2.0" },
    { "id": "2.2", "title": "Explain common threat vectors and attack surfaces.", "domain_id": "2.0" },
    { "id": "2.3", "title": "Explain common vulnerabilities and exploit techniques.", "domain_id": "2.0" },
    { "id": "2.4", "title": "Analyze indicators of malicious activity.", "domain_id": "2.0" },
    { "id": "3.1", "title": "Compare and contrast secure architecture concepts.", "domain_id": "3.0" },
    { "id": "3.2", "title": "Apply security principles to enterprise infrastructure.", "domain_id": "3.0" },
    { "id": "3.3", "title": "Compare and contrast concepts and strategies to protect data.", "domain_id": "3.0" },
    { "id": "3.4", "title": "Explain resilience and environmental design considerations.", "domain_id": "3.0" },
    { "id": "4.1", "title": "Apply common security techniques to computing resources.", "domain_id": "4.0" },
    { "id": "4.2", "title": "Explain security implications of asset management.", "domain_id": "4.0" },
    { "id": "4.3", "title": "Troubleshoot common security issues.", "domain_id": "4.0" },
    { "id": "4.4", "title": "Explain security alerting and monitoring concepts.", "domain_id": "4.0" },
    { "id": "4.5", "title": "Modify enterprise capabilities to enhance security.", "domain_id": "4.0" },
    { "id": "4.6", "title": "Implement and maintain identity and access management.", "domain_id": "4.0" },
    { "id": "4.7", "title": "Explain automation and orchestration in security operations.", "domain_id": "4.0" },
    { "id": "4.8", "title": "Explain and execute incident response activities.", "domain_id": "4.0" },
    { "id": "5.1", "title": "Compare and contrast governance, risk, and compliance concepts.", "domain_id": "5.0" },
    { "id": "5.2", "title": "Explain elements of the risk management process.", "domain_id": "5.0" },
    { "id": "5.3", "title": "Explain third-party risk assessment and management.", "domain_id": "5.0" },
    { "id": "5.4", "title": "Summarize elements of effective security compliance.", "domain_id": "5.0" },
    { "id": "5.5", "title": "Explain types and purposes of security audits and assessments.", "domain_id": "5.0" },
    { "id": "5.6", "title": "Implement security awareness practices.", "domain_id": "5.0" },
    { "id": "5.7", "title": "Explain privacy and sensitive data concepts.", "domain_id": "5.0" }
  ]
}
